{
  "scenario_family": "d1-budget",
  "pair": [
    "v05-d1-autogen-pass-budget-allow",
    "v05-d1-langgraph-pass-budget-allow"
  ],
  "differences": [
    {
      "note_code": "MISSING_ADMISSIBILITY_EVIDENCE",
      "params": {
        "run_id": "v05-d1-autogen-pass-budget-allow"
      }
    },
    {
      "note_code": "MISSING_ADMISSIBILITY_EVIDENCE",
      "params": {
        "run_id": "v05-d1-langgraph-pass-budget-allow"
      }
    },
    {
      "note_code": "VALUE_HASH_MISMATCH",
      "params": {
        "pointer": "/normalized_hash",
        "left_hash": "6c91380300094c8d",
        "right_hash": "b96cdb021310858d"
      }
    }
  ],
  "disclaimer": "Equivalence refers to evidence projection similarity under the specified \nruleset and hash scope. It does not constitute framework certification, \ncapability endorsement, or compliance verification.\n"
}